{
  "proof_type": "human_review",
  "review_batch_id": "human-review-template",
  "created_at": "YYYY-MM-DDTHH:MM:SSZ",
  "reviewer_count": 0,
  "reviewer_roles": [],
  "dataset_name": "template_only_dataset",
  "sample_size": 0,
  "sampling_method": "template_only",
  "privacy_sanitized": false,
  "review_items": [],
  "agreement_metrics": {
    "comparable_item_count": 0,
    "decision_agreement_rate": 0.0
  },
  "adjudication_required_count": 0,
  "adjudication_completed_count": 0,
  "bad_case_count": 0,
  "summary": {
    "total_items": 0,
    "pass_count": 0,
    "fail_count": 0,
    "minor_issue_count": 0,
    "major_issue_count": 0,
    "pass_rate": 0.0,
    "average_correctness_score": 0.0,
    "average_groundedness_score": 0.0,
    "average_safety_score": 0.0,
    "hallucination_rate": 0.0,
    "fabrication_rate": 0.0,
    "privacy_risk_count": 0,
    "adjudication_completion_rate": 0.0,
    "production_quality_candidate_signal": false
  },
  "production_quality_candidate_signal": false,
  "limitations": [
    "Template only; import private CSV/JSONL review data with scripts/import_human_review_batch.py.",
    "Reviewer identities, raw case text, provider traces and private comments must not be committed."
  ]
}
